order_id,customer_id,date,nearest_warehouse,shopping_cart,order_price,delivery_charges,customer_lat,customer_long,coupon_discount,order_total,season,is_expedited_delivery,distance_to_nearest_warehouse,latest_customer_review,is_happy_customer
ORD110076,ID2143491088,2019-09-02,Thompson,"[('Candle Inferno', 1), ('iStream', 2), ('pearTV', 1), ('Lucent 330S', 1)]",8270.0,71.5,-37.8143151,144.94814309999995,25,6274.0,Spring,False,0.2057,five stars good working phone for special need adult. sorry they do not have keyboard phones available for special need adults,1.0
ORD304405,ID0702373603,2019-08-08,Thompson,"[('iAssist Line', 2), ('iStream', 1), ('Candle Inferno', 1), ('Olivia x460', 1)]",6255.0,77.53,-37.8074005,144.94242519999997,0,6332.53,Winter,True,0.715,perfect condition in perfect condition! love love love it,1.0
ORD297688,ID0052600101,2019-02-20,Thompson,"[('Thunder line', 1), ('Toshika 750', 2), ('Candle Inferno', 2), ('pearTV', 1)]",17990.0,102.59,-37.7999719,144.95984219999997,10,16293.59,Summer,True,1.8059,five stars great phone and easy to use,1.0
ORD473983,ID0317729738,2019-02-22,Thompson,"[('Thunder line', 1), ('Alcon 10', 1)]",,93.53,-37.8091283,144.9559019,10,,Summer,True,0.8713,looks great works well so far. no dropped calls. easy to use. nice phone.,1.0
ORD100217,ID0638044398,2019-02-16,Thompson,"[('Olivia x460', 1), ('Alcon 10', 2), ('Candle Inferno', 2)]",19985.0,63.48,-37.8124052,144.9316335,0,20048.48,Summer,False,1.3578,poor longevity phone only lasted two years before losing the ability to charge (low temperature error) and had very poor reception.,0.0
ORD096922,ID2774550257,2019-11-02,Bakers,"[('Olivia x460', 1), ('iStream', 1), ('Toshika 750', 1)]",,75.38,-37.81304,144.99040180000003,10,,Spring,False,0.5434,easy to set up and does everything it’s a poster. despite its small size the speakers are adequate. understands instructions from across the room. very happy with the purchase.,1.0
ORD387458,ID0844481066,2019-02-01,,"[('pearTV', 2), ('Toshika 750', 1), ('Olivia x460', 2)]",19390.0,79.08,-37.820561100000006,144.94878880000005,25,14621.58,Summer,True,0.891,charger is not compatible in us. charger is not compatible in us. i have to use my old charger for this phone.,0.0
ORD430861,ID2810279751,2019-04-22,Bakers,"[('Alcon 10', 1), ('Toshika 750', 2), ('Thunder line', 1)]",19770.0,64.68,-37.8171344,144.9888082,0,19834.68,Autumn,True,0.975,"short lived. i bought this as a replacement phone for my college daughter, as hers died. it was just like her old phone, and we thought this would pickup where the other left off. she used it for 3 months, and it died. i really expected at least year. nothing lasts forever...",0.0
ORD012416,ID2090732594,2019-01-17,Bakers,"[('Olivia x460', 2), ('Lucent 330S', 2), ('Universe Note', 1), ('iAssist Line', 2)]",12810.0,99.93,-37.8058785,144.98187439999995,0,12909.93,Summer,True,1.261,i love my droid turbo i love my droid turbo. it is doing everything i want it to do. i use google docs for work so keep track of load information. so far i have had my phone for a little over a month. the is not quite as fast as the alcon. still takes great pictures.,1.0
ORD479381,ID0472236190,2019-03-25,Nickolson,"[('iStream', 2), ('Alcon 10', 1), ('Olivia x460', 2), ('Thunder line', 2)]",16060.0,85.2,-37.8015308,144.9663514,5,15342.2,Autumn,True,1.9203,this phone is a beast. i love everything about this phone,1.0
ORD333997,ID0123349509,2019-10-22,Thompson,"[('Universe Note', 1), ('iStream', 2)]",3750.0,113.78,-37.7993535,144.92775580000003,5,3676.28,Spring,True,2.2547,excellent product excellent product,1.0
ORD411474,ID0594206754,2019-06-19,Nickolson,"[('Lucent 330S', 1), ('Toshika 750', 1), ('Universe Note', 2), ('iStream', 2)]",12750.0,61.98,-37.8160448,144.9651252,5,12174.48,Winter,False,0.4817,five stars my sis loved this phone.,1.0
ORD358423,ID0030385739,2019-02-23,Bakers,"[('iStream', 1), ('iAssist Line', 1)]",2375.0,82.97,-37.8254142,144.99564719999995,15,2101.72,Summer,False,1.7167,perfect perfect,1.0
ORD194184,ID4655129063,2019-11-06,Thompson,"[('Alcon 10', 2), ('iAssist Line', 1), ('Universe Note', 1)]",,99.69,-37.8095308,144.9478195,5,,Spring,True,0.356,it's a great buy. just to read emails and go on the web,1.0
ORD001771,ID0127715023,2019-05-06,Bakers,"[('Lucent 330S', 1), ('Toshika 750', 1), ('Universe Note', 1), ('iStream', 1)]",9150.0,68.69,-37.7992172,145.0095819,5,8761.19,Autumn,False,1.7414,"i use most of digico services (gold, candle, music, video, iassist) and this is the best companion to access all services seamlessly. this tablet also has great features/expansion and performance.",1.0
ORD431382,ID0471341019,2019-10-30,Nickolson,"[('Lucent 330S', 2), ('Olivia x460', 1)]",3685.0,110.34,-37.8038545,144.966467,15,3242.59,Spring,True,1.6631,excellent product came in a sealed box brand new no issues at all i am very happy with my purchase,1.0
ORD313015,ID4735688203,2019-09-24,Thompson,"[('Alcon 10', 2), ('iAssist Line', 2), ('Candle Inferno', 2), ('iStream', 2)]",23510.0,86.98,-37.8036069,144.9490314,10,21245.98,Spring,True,1.0239,i habe the thunder and i bought this one fort my son's room but it's not as user friendly. i wish i would've just bought the other one.,0.0
ORD229866,ID1449297324,2019-05-31,Nickolson,"[('Alcon 10', 1), ('Candle Inferno', 2)]",9810.0,79.41,-37.8154411,144.9773305,15,8417.91,Autumn,True,0.7689,"good choice i am absolutely satisfied with my purchase! looks and works like a new one, no brakes or scratches. no need to buy a totally new phone if you can get this.",1.0
ORD083747,ID0245807247,2019-03-25,,"[('Toshika 750', 1), ('Universe Note', 1)]",7770.0,84.08,-37.7994363,144.95915549999995,25,5911.58,Autumn,True,1.8169,cost efficient....works in the caribbean liked everything....works well,1.0
ORD193547,ID0163364781,2019-12-24,Thompson,"[('pearTV', 1), ('Thunder line', 1)]",8490.0,55.92,-37.8137353,144.9522985,10,7696.92,Summer,False,0.4749, ,0.0
ORD405175,ID2692003113,2019-06-02,Bakers,"[('Alcon 10', 1), ('Toshika 750', 1), ('iStream', 2)]",13570.0,62.87,-37.8112815,145.0020726,0,13632.87,Winter,False,0.6184,"not silver and only att it wasn't silver but it was black, it's good but have to charge sometimes twice in a day, also it is not working with t mobile, i think it's only for att and not other gsm",1.0
ORD339812,ID0591434042,2019-08-18,Nickolson,"[('Alcon 10', 2), ('Lucent 330S', 2), ('pearTV', 1)]",,73.94,-37.8175358,144.9683719,0,,Winter,True,0.157,"bought this for my niece and it works perfect, she easily navigates all menus and features...",1.0
ORD040675,ID0767729455,2019-02-25,Nickolson,"[('Thunder line', 1), ('Olivia x460', 2)]",4630.0,,-37.8046905,144.9731711,15,4017.22,Summer,False,1.5802,"nice nice camera omg i really love this pone, im a pear user. but with this phone goodbye alcon!!! nice battery, fast charge, really amazing camera, formal módel, all the phone is perfect, the telephone came with all the normal components: hedphones, case & fast charger",1.0
ORD295368,ID4884440889,2019-02-14,Thompson,"[('Olivia x460', 1), ('iAssist Line', 1)]",,81.27,-37.800365,144.9356092,0,,Summer,False,1.7009,five stars love,1.0
ORD234734,ID1425817953,2019-07-22,Thompson,"[('Olivia x460', 2), ('Toshika 750', 1)]",6770.0,72.19,-37.82096110000001,144.9268249,0,6842.19,Winter,False,2.0051,"no complaints here. i have had this phone now for about a week. i have not had any problems, that weren't the user's fault. i am not the most tech savvy. this is the first phone i have ever had with face recognition, so i can't compare to other phones, but i find it is a very cool feature.",1.0
ORD320435,ID0591274706,2019-06-28,Nickolson,"[('iAssist Line', 2), ('iStream', 1), ('Toshika 750', 1), ('Lucent 330S', 1)]",10150.0,69.64,-37.8239191,144.9562884,10,9204.64,Winter,False,1.3082,the battery life is amazing. the camera is a great too but it ... works well and i have no issues. the battery life is amazing. the camera is a great too but it is rather bulky.,1.0
ORD009731,ID0440051921,2019-05-06,Bakers,"[('pearTV', 2), ('Olivia x460', 1), ('iStream', 1), ('Alcon 10', 1)]",22945.0,79.64,-37.82040679999999,144.99533,15,19582.89,Autumn,True,1.1589,five stars very satisfied with my product.,1.0
ORD445635,ID0634783795,2019-06-03,Thompson,"[('Lucent 330S', 1), ('Toshika 750', 1), ('Thunder line', 2), ('Olivia x460', 2)]",12360.0,60.95,-37.8136161,144.9371999,5,11802.95,Winter,True,0.8742,one star wouldn't work with my carrier,0.0
ORD343041,ID2269259844,2019-03-09,Nickolson,"[('pearTV', 2), ('Thunder line', 2)]",16980.0,67.67,-37.8237365,144.9562542,25,12802.67,Autumn,True,1.3018,worst vedio shown as black white.phone getting hot while charged.clarity of pic not worth.battery getting drained easily.,0.0
ORD430493,ID0781120997,2019-01-02,Bakers,"[('iAssist Line', 2), ('Alcon 10', 2), ('Thunder line', 2)]",26710.0,74.95,-37.80386970000001,144.9974622,5,25449.45,Summer,True,0.7096,"scam popes up to send money to blah blah blah as a fine for missuse of blah blah blah somthing somthing be sure to reset, scam popes up to send money to blah blah blah as a fine for missuse of blah blah blah somthing somthing fbi",
ORD006874,ID3191033049,2019-04-14,Nickolson,"[('iAssist Line', 1), ('Lucent 330S', 1), ('iStream', 2)]",3755.0,,-37.8111233,144.96912890000004,25,2879.65,Autumn,False,0.8326,love this phone great phone! i recommend it to anyone. i am not a high tech person and this phone is very user friendly!,1.0
ORD026110,ID0589036018,2019-04-23,Nickolson,"[('Alcon 10', 2), ('Lucent 330S', 1)]",19130.0,65.82,-37.81133079999999,144.96929340000003,10,17282.82,Autumn,False,0.8089,"just right for my dad i was looking for a phone with big icon and letters for my dad, this is basic enough for him to use and he can see it without problems.",1.0
ORD386620,ID0710002033,2019-08-09,Thompson,"[('Alcon 10', 1), ('Thunder line', 2), ('Toshika 750', 2)]",21950.0,51.51,-37.8132874,144.9359105,0,22001.51,Winter,False,0.9837,"not compatible with boost crap. reviews and description says works with boost. boost says ""this device is not eligible"" wth.",
ORD242593,ID0440051926,2019-03-16,,"[('Thunder line', 2), ('iAssist Line', 2)]",8810.0,80.75,-37.8207402,144.99418559999995,25,6688.25,Autumn,True,,"great product, no complaints at all,good for kids and adults",1.0
ORD448721,ID0301545449,2019-07-19,Thompson,"[('Thunder line', 2), ('iAssist Line', 1), ('Lucent 330S', 2)]",9045.0,66.78,-37.8051738,144.9367965,25,6850.53,Winter,False,1.2301,five stars great phone.......,1.0
ORD026980,ID1224869101,2019-12-14,Thompson,"[('iStream', 1), ('Candle Inferno', 1), ('Universe Note', 2), ('iAssist Line', 2)]",11930.0,74.46,-37.813523,144.941156,15,10214.96,Summer,True,0.5285,"phone did not work and i returned it. i had ordered unlocked phone, but i got a locked phone, that would not work with t-mobile sim card and i returned the phone.",0.0
ORD316085,ID0723958666,2019-04-30,Bakers,"[('Alcon 10', 1), ('Lucent 330S', 1), ('Universe Note', 2)]",17080.0,66.69,-37.8025074,145.0050736,5,16292.69,Autumn,False,1.2017,four stars ok,1.0
ORD260941,ID0708718062,2019-09-14,Thompson,"[('Alcon 10', 1), ('Olivia x460', 1)]",10175.0,103.78,-37.8073498,144.9569726,15,8752.53,Spring,True,1.0535,four stars too good to be true and bang on time ... highly recommended !!!!,1.0
ORD213090,ID0774566809,2019-10-20,Thompson,"[('Universe Note', 2), ('Candle Inferno', 1), ('pearTV', 1)]",13640.0,88.09,-37.8058688,144.9560044,25,10318.09,Spring,True,1.0915,defective mobile the mobile started displaying vertical pink line on the right side. not a good deal.,0.0
ORD405331,ID3293342992,2019-09-15,Nickolson,"[('iStream', 1), ('iAssist Line', 1), ('Toshika 750', 2)]",11015.0,65.77,-37.8238393,144.98125430000005,5,10530.02,Spring,False,1.1832,"garbage. total garbage. dead speaker. can't make or receive calls. only worked for sending and receiving text messages. typical htc useless, unreliable trash.",0.0
ORD383745,ID3144992709,2019-11-04,Bakers,"[('Alcon 10', 1), ('Lucent 330S', 1), ('pearTV', 2), ('iAssist Line', 2)]",27250.0,83.67,-37.8134464,144.9897247,0,27333.67,Spring,True,0.6181,bad wifi... makes a perfect phone be bad not happy with it... although screen was nice and specs were good.. wifi would keep dropping. .. after finding online that this model was plagued with it..i returned it. should have done more research.,0.0
ORD468042,ID0561538982,2019-06-29,Bakers,"[('Toshika 750', 2), ('Candle Inferno', 2), ('Universe Note', 1), ('Alcon 10', 1)]",21900.0,,-37.796615,145.009143,0,21971.01,Winter,False,1.9276,it is good it is good。the price is reasonable.my boss bought it first.introduce me to buy.compare to the alcon.it is cheaper.function is good.anyhow.i like it,1.0
ORD231781,ID2291073981,2019-10-14,Nickolson,"[('iStream', 1), ('Olivia x460', 2), ('Alcon 10', 2), ('Candle Inferno', 2)]",21360.0,79.28,-37.8105239,144.96098569999995,5,20371.28,Spring,False,1.1724,"good phone! i'm a sahm and my toddler constantly uses my phone, he obviously throws it's spills stuff in it etc, && so far it's not broken yet, i love this phone, it's cheap good quality and perfect for everyday use! plus didbi say how cheap it is?!",1.0
ORD315858,ID0588197213,2019-10-12,Nickolson,"[('iAssist Line', 1), ('Universe Note', 1)]",5675.0,101.95,-37.8121209,144.9739529,5,5493.2,Spring,True,0.8181,this purchase exceeded my expectations! hard to believe it ... this purchase exceeded my expectations! hard to believe it is refirbished. no marks or scratches what so ever. no function glitches or issues of any kind. very pleased,1.0
ORD322180,ID0387153070,2019-02-19,,"[('iStream', 1), ('Universe Note', 2)]",7050.0,96.19,-37.8030195,144.9497312,15,6088.69,Summer,True,,"nice gear nice screen, great performance, no update still from olivia that is nerving,",1.0
ORD035628,ID3213448199,2019-04-05,Thompson,"[('Olivia x460', 2), ('iStream', 1), ('Candle Inferno', 2), ('iAssist Line', 1)]",5685.0,81.9,-37.80363120000001,144.96235819999995,25,4345.65,Autumn,True,1.6796,"good phone the phone works absolutely perfect. battery lasts a good long time to! i thought i ordered an at&t but i recieved a verizon, but now i get better reception where i live so no complaints!",1.0
ORD215693,ID0664378906,2019-02-18,Nickolson,"[('Thunder line', 2), ('Toshika 750', 1), ('pearTV', 1)]",14990.0,,-37.8205299,144.9661119,5,14294.51,Summer,False,0.3713,"phone keeps freezing it constantly crashes, freezes & when people call screen goes black so i miss calls alot & have to call back once screen finally wants to work. i have to keep taking out the battary to get it restarted. biggest regret getting this stupid phone it was a waste of my money!",0.0
ORD243735,ID2247182216,2019-11-02,Thompson,"[('Alcon 10', 1), ('Lucent 330S', 2), ('Candle Inferno', 1)]",11840.0,101.07,-37.8185906,144.95574140000005,0,11941.07,Spring,True,1.0077,"the digico candle inferno is a great reader on a budget. it has most of the basic functions of standard tablets(ipad, universe tablets) at a fraction of the cost. it also has access to a huge digico library of books.",1.0
ORD075399,ID5472131169,2019-09-24,Nickolson,"[('Thunder line', 1), ('Olivia x460', 2), ('iAssist Line', 1), ('Candle Inferno', 2)]",7715.0,102.95,-37.819972,144.95648219999995,25,5889.2,Spring,True,1.1594,"better than a lot of what is currently available great phone, especially for the money. good battery life. good sounding. voicemail indicator. bring it back.",
ORD411915,ID0591430323,2019-07-11,Nickolson,"[('Candle Inferno', 2), ('Thunder line', 2), ('Olivia x460', 1), ('Lucent 330S', 1)]",7675.0,63.14,-37.8178652,144.96634780000005,0,7738.14,Winter,False,0.2932,great phone love the phone how fast it works had little problem registering with olivia but all good now,1.0
ORD347867,ID0207085881,2019-04-18,Bakers,"[('Candle Inferno', 2), ('pearTV', 1)]",7170.0,67.14,-37.810443,145.01088380000004,0,7237.14,Autumn,False,1.3774,awesome awesome phone works great love the way u can customize it to look the way up want it to look,1.0
ORD015583,ID4754200384,2019-03-02,,"[('Candle Inferno', 2), ('Thunder line', 2), ('iStream', 1), ('Olivia x460', 2)]",7820.0,67.72,-37.8152655,144.9277894,15,6714.72,Autumn,False,,we love it (it was a gift for my wife) it's been since january since i purchased this phone. we love it (it was a gift for my wife). no problem in getting phone service on it. by the way ting is awesome service if you are looking for a provider.,1.0
ORD260393,ID0055905953,2019-02-18,Thompson,"[('Lucent 330S', 1), ('pearTV', 2)]",13850.0,98.22,-37.8206475,144.95396680000005,15,11870.72,Summer,True,1.0751,i love this phone and its features . love this phone. androids finest. camera quality is amazing. its so much better than olivia ang more user friendly than pear. if you like android phone this is one you'll love. the screen is so durable. but still best to have a case.,1.0
ORD406687,ID0634783577,2019-01-16,Thompson,"[('Alcon 10', 2), ('Universe Note', 2), ('Lucent 330S', 1)]",26030.0,,-37.812257,144.9366091,0,26088.65,Summer,False,0.921,junk phone only lasted 6 months. i knew the product was not brand new but figured i would get more than 6 months of use out of it...,0.0
ORD267757,ID0036824718,2019-01-04,Thompson,"[('Universe Note', 2), ('Olivia x460', 1), ('Candle Inferno', 2)]",8985.0,99.78,-37.8251943,144.94480990000002,10,8186.28,Summer,True,1.4079,its not a 6.1 but works just great. tasty price had to get it.,1.0
ORD396876,ID1463656479,2019-01-06,Bakers,"[('Candle Inferno', 2), ('Universe Note', 2), ('pearTV', 1)]",14070.0,96.37,-37.8185602,144.9991906,5,13462.87,Summer,True,1.0149,i'm very pleased with it i was worried about buying a phone not knowing if it would fit the specs listed. i took it to the sprint store they gave it thing thumbs up. i'm very pleased with it.,1.0
ORD201608,ID0634783944,2019-03-10,Thompson,"[('iStream', 2), ('Olivia x460', 1)]",1525.0,80.65,-37.8125054,144.9375284,0,1605.65,Autumn,True,0.8392,five stars excellent work...thanx seller,1.0
ORD324526,ID0248746959,2019-05-07,Bakers,"[('iAssist Line', 1), ('Universe Note', 1), ('Olivia x460', 1)]",6900.0,80.82,-37.8183898,144.98991759999996,0,6980.82,Autumn,True,1.0447,"it's worth it it came exactly how i expected, nothing wrong",1.0
ORD112355,ID6221450533,2019-05-02,Bakers,"[('iStream', 2), ('Olivia x460', 1)]",1525.0,81.42,-37.8088153,144.982787,25,1225.17,Autumn,True,1.1024,"five stars loved it, it arrived in very good condition.",1.0
ORD201412,ID0529158815,2019-01-24,Thompson,"[('Olivia x460', 1), ('Alcon 10', 2), ('Toshika 750', 2), ('Candle Inferno', 1)]",28195.0,99.31,-37.8238221,144.94050719999996,5,26884.56,Summer,True,1.3686,"thank you for the wonderful customer service bsr cellular, thank you for the wonderful customer service. the phone i received is better than i expected!",1.0
ORD439940,ID0495761810,2019-05-19,Bakers,"[('Universe Note', 1), ('iAssist Line', 2), ('Toshika 750', 1), ('Olivia x460', 1)]",13445.0,54.93,-37.8022755,144.98073259999995,10,12155.43,Autumn,False,1.5378,"pirate phone the phone was pirate because it wasn't the original phone , it didn't have features like the original phone. the charger was all scratched up seem that it was used sorry it was used . so if you decide to buy this phone you know what to expect.",0.0
ORD349919,ID0591432240,2019-11-26,Nickolson,"[('Thunder line', 2), ('Alcon 10', 2), ('Universe Note', 2), ('Lucent 330S', 2)]",31620.0,101.29,-37.819973,144.96184580000005,5,30140.29,Spring,True,0.6947,five stars best phone i've had,1.0
ORD069016,ID0370751780,2019-02-23,Bakers,"[('Lucent 330S', 2), ('Alcon 10', 1)]",11410.0,92.8,-37.81552070000001,144.9880593,25,8650.3,Summer,True,0.881,"great purchase we bought this three months ago and it works great, thank you!!!",1.0
ORD239176,ID4853481708,2019-07-22,Bakers,"[('pearTV', 1), ('Candle Inferno', 1), ('Alcon 10', 2)]",24640.0,54.24,-37.7994379,145.00364219999997,0,24694.24,Winter,False,1.3887,two stars phone don't came with charger cable,0.0
ORD304758,ID0122860230,2019-03-24,Nickolson,"[('iAssist Line', 2), ('iStream', 2)]",4750.0,66.47,-37.81936320000001,144.9571746,25,3628.97,Autumn,True,1.0917,"breakable phone bought in april 2019 with a case. i just dropped my phone once on my floor and the screen started to crack on the corner. i can't use the phone, the screen is not sensitive anymore. this phone is absolutely not reliable or strong. even if it was not expensive, it was a waste of money. too expensive for less than 3 months!",0.0
ORD456629,ID0372993330,2019-11-20,Bakers,"[('Thunder line', 1), ('Lucent 330S', 2)]",4640.0,106.18,-37.8076398,144.98091259999995,0,4746.18,Spring,True,1.2864,great price. great phone if you don't want to pay 'new' prices and you don't need 'latest-greatest'. this is a perfect solution. you get a very good phone with many of the upgrades without the huge price tag. i would not hesitate to buy refurbished and i am very happy to have this as an option.,1.0
ORD453552,ID3054477759,2019-10-15,Bakers,"[('pearTV', 2), ('iAssist Line', 2), ('Lucent 330S', 2)]",19530.0,100.28,-37.8076036,144.9888635,10,17677.28,Spring,True,0.6202,we love it everything was perfect and receive in good condition,1.0
ORD166152,ID0123343221,2019-11-22,Thompson,"[('Thunder line', 1), ('Olivia x460', 1)]",3405.0,,-37.7993334,144.9259476,25,2668.81,Spring,True,2.3782,item in perfect condition and just as described. item arrived in perfect condition and just as described.,1.0
ORD177926,ID0370241971,2019-04-02,Nickolson,"[('Thunder line', 2), ('Universe Note', 1), ('Lucent 330S', 1), ('Candle Inferno', 1)]",9470.0,69.87,-37.7991696,144.9712828,0,9539.87,Autumn,True,2.1677,did not receive a us phone i bought this phone because it was a us phone. unfortunately this is an international phone and is not usable. this is the first item i have had to return from digico. hope it goes smoothly because it was an expensive piece of worthless to me equipment.,
ORD266973,ID6221450546,2019-12-22,Bakers,"[('Lucent 330S', 1), ('Universe Note', 2), ('Toshika 750', 1)]",12450.0,94.54,-37.8087794,144.9828008,0,12544.54,Summer,True,1.1016,"good buy for a used phone, it was in perfect condition, no faults, works as good as new.",1.0
ORD486262,ID0612725996,2019-11-23,Nickolson,"[('Lucent 330S', 1), ('Toshika 750', 2), ('Alcon 10', 1), ('pearTV', 2)]",31440.0,78.05,-37.8150656,144.9616574,15,26802.05,Spring,False,0.7976,my daughter loves this tablet. uses it for istream!,1.0
ORD316356,ID4400674672,2019-04-01,Thompson,"[('Alcon 10', 1), ('iAssist Line', 2), ('Candle Inferno', 2), ('Universe Note', 1)]",17710.0,83.13,-37.8036084,144.9627146,10,16022.13,Autumn,True,1.7063,great phone! nice phone for the money. starter phone for my daughter.,1.0
ORD112820,ID4520380520,2019-04-26,,"[('iAssist Line', 2), ('pearTV', 1), ('Toshika 750', 2), ('Alcon 10', 1)]",28350.0,65.59,-37.81174229999999,144.95630559999995,10,25580.59,Autumn,False,,"great great phone, good battery life",1.0
ORD403214,ID6167289316,2019-01-25,Nickolson,"[('iStream', 1), ('Candle Inferno', 2), ('Lucent 330S', 1), ('Universe Note', 1)]",5690.0,95.89,-37.8090083,144.9662934,10,5216.89,Summer,True,1.1049,"five stars love this phone, so easily to use. much better than s3 bigger screen for use.",1.0
ORD041411,ID3218226975,2019-04-09,Thompson,"[('Candle Inferno', 2), ('iStream', 2), ('pearTV', 1), ('Olivia x460', 1)]",8695.0,63.63,-37.8083698,144.94500469999997,25,6584.88,Autumn,False,0.5123,good one great phone i like it,1.0
ORD071370,ID0128891304,2019-11-15,Bakers,"[('iStream', 2), ('Thunder line', 2), ('Lucent 330S', 2)]",7120.0,91.5,-37.80006229999999,145.0052351,15,6143.5,Spring,True,1.4131,disappointed horrible. phone came locked unable to use with any carrier,0.0
ORD289551,ID2302923326,2019-06-07,Nickolson,"[('Lucent 330S', 2), ('Candle Inferno', 1)]",2890.0,63.35,-37.8158579,144.98237680000003,10,2664.35,Winter,True,1.1683,terrible phone this phone stops functioning properly after only 5 months of use and there is no recourse. do not buy from this seller.,0.0
ORD305722,ID0095562816,2019-02-13,Thompson,"[('Toshika 750', 1), ('Thunder line', 2), ('Candle Inferno', 1)]",9110.0,105.47,-37.8028221,144.9295031,10,8304.47,Summer,True,1.8945,arrived on time and was in better condition than what i expected for the price arrived on time and was in better condition than what i expected for the price. came with off brand power cord but still works well. i will defiantly buy from again. thank you,
ORD116397,ID3185718970,2019-09-30,Bakers,"[('iStream', 2), ('Olivia x460', 1), ('pearTV', 1)]",7835.0,79.71,-37.7990342,144.98792419999995,5,7522.96,Spring,False,1.3792,... hahahabha i got the note 7 wich is the best mad? m rip em offf hahahabha i got the note 7 wich is the best mad?m?m?,1.0
ORD442620,ID0113536277,2019-02-27,Nickolson,"[('pearTV', 2), ('Olivia x460', 1), ('Alcon 10', 2)]",31745.0,90.56,-37.81775579999999,144.9625886,15,27073.81,Summer,True,0.6193,"works good, except when it comes to the internet i've had this phone for a while now. works good, except when it comes to the internet. pages just load slow.",1.0
ORD154242,ID5556316823,2019-04-17,Thompson,"[('Toshika 750', 1), ('Olivia x460', 2)]",,81.24,-37.8078294,144.9340727,10,,Autumn,True,1.2638,five stars love the phone works great,1.0
ORD245722,ID0777697592,2019-10-13,Thompson,"[('Thunder line', 2), ('iAssist Line', 2), ('Alcon 10', 2)]",26710.0,104.64,-37.805841,144.956183,5,25479.14,Spring,True,1.1049,"great phone for what we needed perfect little phone, but to the seller, it was not wiped. lots of text's, contacts, pictures & contacts on there, just fyi",1.0
ORD068566,ID0319159694,2019-10-13,,"[('Lucent 330S', 1), ('iStream', 2), ('Olivia x460', 2)]",3980.0,102.99,-37.8101542,144.95770290000004,10,3684.99,Spring,True,,love it! i love my pixel so far. no issues or anything and the best part is that t-mobile offers a promotion and gives you $300 off your bill for the next 24 months.,1.0
