order_id,customer_id,date,nearest_warehouse,shopping_cart,order_price,delivery_charges,customer_lat,customer_long,coupon_discount,order_total,season,is_expedited_delivery,distance_to_nearest_warehouse,latest_customer_review,is_happy_customer
ORD082484,ID1463620953,2019-09-20,Bakers,"[('Toshika 750', 2), ('Universe Note', 2)]",15540.0,,-37.8186231,145.0003569,0,15643.2,Spring,True,1.0608,my fantastic note 9 i love this phone. i couldn't believe that i could transfer everything from my old phone at home. not only contacts but pictures and email as well as text.....love..... love... love it !,1.0
ORD092938,ID0589664986,2019-05-22,Thompson,"[('iAssist Line', 1), ('iStream', 2), ('Olivia x460', 2), ('pearTV', 1)]",11285.0,80.1,-37.82140029999999,144.9543615,25,8543.85,Autumn,True,1.1641,love my new phone i had a four year old olivia s4 with a dead battery. the g6 is light years better than my old phone and a lot less expensive than a new olivia s9. i feel like i'm carrying around a computer. now i wish i had ditched the old olivia sooner.,
ORD241424,ID0131102989,2019-12-31,Thompson,"[('pearTV', 1), ('Olivia x460', 2), ('Thunder line', 1)]",10940.0,74.23,-37.8145184,144.958323,0,11014.23,Summer,False,1.0108,love the inferno stick. iassist works well on it too. would recommend.,1.0
ORD407184,ID2776667772,2019-02-13,Nickolson,"[('Thunder line', 2), ('Universe Note', 1), ('Olivia x460', 1), ('Toshika 750', 1)]",13355.0,99.65,-37.824394700000006,144.95539219999995,5,12786.9,Summer,True,1.4025,pixel very nice very good,1.0
ORD265520,ID0294622371,2019-01-19,,"[('Lucent 330S', 2), ('iAssist Line', 1), ('Thunder line', 1)]",6865.0,67.49,-37.8185502,144.96710990000003,10,6245.99,Summer,False,,"it was cheaper to buy a new phone than to ... it was cheaper to buy a new phone than to fix a broken screen, and this one works perfectly. if i were buying something new though i'd look for something with more memory.",1.0
ORD014234,ID5002595134,2019-09-19,Thompson,"[('Toshika 750', 1), ('Alcon 10', 1), ('iAssist Line', 1), ('Thunder line', 1)]",17675.0,99.93,-37.8120614,144.95314530000005,0,17774.93,Spring,True,0.5387,"four stars love this phone. it's fast, easy to use and the screen is a good size.",1.0
ORD431729,ID4315827383,2019-11-11,Bakers,"[('Universe Note', 1), ('pearTV', 2), ('Candle Inferno', 2), ('Lucent 330S', 1)]",18160.0,82.9,-37.8250001,144.99805969999997,15,15518.9,Spring,False,1.6886,pitchers is very clear i love everything about this phone,1.0
ORD086049,ID3114181802,2019-08-03,,"[('pearTV', 1), ('Olivia x460', 1), ('iAssist Line', 1), ('Thunder line', 1)]",11940.0,79.81,-37.8110706,144.9636135,10,10825.81,Winter,True,0.987,awesome amazing product thank you,1.0
ORD312682,ID0291210710,2019-05-16,Nickolson,"[('Candle Inferno', 1), ('iStream', 1), ('pearTV', 2)]",13200.0,53.62,-37.8068371,144.9651055,5,12593.62,Autumn,False,1.366,having some problems with our thunder. does not hold the internet connection. other devices on the wifi are fine.,0.0
ORD259982,ID0384006483,2019-11-13,Bakers,"[('Candle Inferno', 2), ('Universe Note', 1), ('Lucent 330S', 2), ('pearTV', 2)]",19390.0,105.17,-37.8002472,144.98809330000003,5,18525.67,Spring,True,1.2538,"the seller did resolve my issue with satisfaction and i now have a working phone at a good word of advice, ask to verify the imei before purchase. the seller did resolve my issue with satisfaction and i now have a working phone at a good price",1.0
ORD197156,ID2755217882,2019-03-02,Bakers,"[('Alcon 10', 2), ('pearTV', 2), ('Olivia x460', 2)]",32970.0,66.11,-37.8048505,144.9935105,10,29739.11,Autumn,False,0.5925,awesome phone! tough as nails and wate/shock resistance i love this phone. i work in a very busy office and i am always dropping my phone and getting it wet. this phone is extremely durable and water resistant or in my case coffee resistant. i can't say enough about this pone. love it!!,1.0
ORD068264,ID0174789329,2019-11-18,Nickolson,"[('Olivia x460', 2), ('iStream', 1)]",2600.0,71.72,-37.8146088,144.9656739,0,2671.72,Spring,False,0.5596,"great phone i was nervous buying a used phone online, but with the costs of phones these days i figured i'd try it out. product was in perfect condition and was reset. i have had it for a year now and unlike i phones, it still works as good as the day i got it. good job google!",1.0
ORD015374,ID0561538868,2019-10-26,Bakers,"[('Alcon 10', 1), ('Lucent 330S', 2), ('Olivia x460', 1)]",12635.0,,-37.8008899,145.00539609999996,10,11452.91,Spring,False,1.3515,very good device great product,1.0
ORD184193,ID5427967043,2019-08-28,,"[('Candle Inferno', 2), ('iAssist Line', 1)]",3085.0,73.15,-37.8002438,144.95971930000005,0,3158.15,Winter,False,,love it good product,1.0
ORD185771,ID4754200406,2019-10-08,,"[('Olivia x460', 2), ('Universe Note', 1), ('Candle Inferno', 1), ('Alcon 10', 2)]",24230.0,107.96,-37.8167083,144.9273935,10,21914.96,Spring,True,1.7876,simply the best i used to be a alcon fanboy but i i have learned to love this phone. hands down it is the best phone i have ever used in the picture quality particularly at night is amazing. i recommend this phone to everyone.,1.0
ORD466078,ID3945799029,2019-02-08,Thompson,"[('Candle Inferno', 1), ('iStream', 2)]",730.0,78.79,-37.8190592,144.9541293,0,808.79,Summer,True,0.9438,purchased for my kids but it was hard to navigate and ended up with purchasing an ipad,0.0
ORD164768,ID2187983877,2019-09-20,Nickolson,"[('iStream', 1), ('Thunder line', 2), ('pearTV', 1), ('iAssist Line', 1)]",13045.0,76.66,-37.811693700000006,144.9720595,5,12469.41,Spring,False,0.7993,great seller and the best phone great seller and very good phone! a+.. i would buy from this seller again.. thank you!!,1.0
ORD001523,ID2358053628,2019-02-23,Bakers,"[('Alcon 10', 2), ('Thunder line', 2), ('Universe Note', 2)]",29160.0,,-37.8143067,144.98769319999997,15,24878.05,Summer,True,0.8184,we bought this to replace my children's aging ipads and they're very happy.,1.0
ORD037499,ID0373656437,2019-08-19,Thompson,"[('pearTV', 1), ('Lucent 330S', 1)]",7540.0,63.24,-37.812962,144.9314945,10,6849.24,Winter,True,1.37,poor quality. gave it away.,0.0
ORD143651,ID0580321413,2019-03-01,Thompson,"[('iStream', 2), ('Candle Inferno', 1), ('Thunder line', 1)]",2910.0,67.36,-37.8053753,144.9347304,0,2977.36,Autumn,False,1.3555,very helpful with daily activities,1.0
ORD094020,ID0319157921,2019-01-28,Nickolson,"[('iAssist Line', 1), ('Lucent 330S', 1), ('Universe Note', 2), ('Candle Inferno', 2)]",11215.0,78.37,-37.8056468,144.96821509999995,5,10732.62,Summer,False,1.4461,it's not bad it's making to.much nois,
ORD145529,ID4283908171,2019-01-06,Bakers,"[('pearTV', 1), ('Universe Note', 2), ('Lucent 330S', 1)]",14440.0,89.19,-37.8109953,145.000582,15,12363.19,Summer,True,0.4835,very easy to use tablet. lots of apps and game available.,1.0
ORD278073,ID4716795648,2019-06-14,Thompson,"[('Toshika 750', 1), ('Alcon 10', 2), ('Candle Inferno', 2), ('pearTV', 2)]",35700.0,77.71,-37.8189226,144.9533014,15,30422.71,Winter,True,0.8856,excellent conditions it is working very well.,1.0
ORD183604,ID1463620941,2019-12-06,Bakers,"[('Thunder line', 1), ('iAssist Line', 2), ('Alcon 10', 2)]",24530.0,96.32,-37.81488770000001,145.0076372,5,23399.82,Summer,True,1.2193,best quality to price ratio on the market every detail about this phone is amazing including the price. someone posted a review about a bad slider and software. turned out to be completely false.,1.0
ORD173080,ID3832254558,2019-04-08,Bakers,"[('Lucent 330S', 2), ('Universe Note', 1), ('Toshika 750', 2)]",14550.0,68.33,-37.7993323,144.9837031,5,13890.83,Autumn,False,1.5612,must buy five star awesome new everything works perfectly,1.0
ORD490642,ID0364845479,2019-08-02,Bakers,"[('pearTV', 1), ('Thunder line', 1)]",8490.0,81.94,-37.8018354,144.980529,15,7298.44,Winter,True,1.5803,five stars beautiful. fast and quick shipping. love this phone to death. i've missed android.,1.0
ORD223279,ID0702363497,2019-04-21,Thompson,"[('Universe Note', 2), ('iAssist Line', 1)]",9125.0,66.53,-37.8063149,144.9420464,10,8279.03,Autumn,False,0.8343,"i would recommend it it was like new, no sigh of use. didn't really like the charger because it was too loose. but still love the phone.",1.0
ORD447773,ID4315827383,2019-12-04,,"[('pearTV', 1), ('Universe Note', 1), ('iAssist Line', 1), ('Alcon 10', 1)]",20935.0,101.35,-37.8250001,144.99805969999997,0,21036.35,Summer,True,,five stars thank you,1.0
ORD211428,ID0488879338,2019-03-14,Thompson,"[('iAssist Line', 2), ('Universe Note', 2), ('Thunder line', 1), ('pearTV', 2)]",26150.0,79.66,-37.8052387,144.9556241,10,23614.66,Autumn,True,1.1185,great!! this product is great. highly recommend.,1.0
ORD144739,ID0245807835,2019-11-22,Thompson,"[('Lucent 330S', 2), ('Thunder line', 1)]",4640.0,86.12,-37.7988492,144.9596313,0,4726.12,Spring,False,1.8944,loved it.,1.0
ORD134594,ID3094967060,2019-12-05,,"[('pearTV', 2), ('Alcon 10', 2), ('Candle Inferno', 2), ('Universe Note', 1)]",34830.0,82.36,-37.7994083,144.9365256,10,31429.36,Summer,False,,brand new phone love it ! it’s brand brand new phone and i can’t ask for more ! thank you,1.0
ORD420301,ID5402876164,2019-05-16,Nickolson,"[('Toshika 750', 1), ('Olivia x460', 1), ('Alcon 10', 2), ('pearTV', 1)]",29755.0,63.91,-37.8187255,144.9742742,25,22380.16,Autumn,True,0.4156,lcd not good nothing to say,0.0
ORD434972,ID0711327756,2019-01-29,Thompson,"[('pearTV', 1), ('Universe Note', 1), ('Alcon 10', 2), ('iStream', 1)]",27810.0,72.75,-37.8070943,144.9559785,0,27882.75,Summer,False,0.9998,i like that it’s voice activated but it don’t link with any other bluetooth devices only iassist devices,1.0
ORD397464,ID4655086237,2019-05-15,Thompson,"[('pearTV', 2), ('Candle Inferno', 2), ('Toshika 750', 2), ('Lucent 330S', 1)]",23350.0,48.18,-37.8106436,144.9458042,15,19895.68,Autumn,False,0.2518,won't hold a charge it does not hold a charge and then i have to mess with different chargers to which one is going to work,0.0
ORD102042,ID2384097338,2019-03-15,Thompson,"[('Universe Note', 1), ('Olivia x460', 2)]",5900.0,69.51,-37.7988727,144.95796289999996,25,4494.51,Autumn,False,1.8105,three stars good phone,1.0
ORD122709,ID1492169300,2019-03-13,Thompson,"[('Candle Inferno', 1), ('Lucent 330S', 1), ('pearTV', 1)]",7970.0,53.91,-37.80170220000001,144.9636299,10,7226.91,Autumn,False,1.9008,the phone that was sent to us was from yemen ... the phone that was sent to us was from yemen and could not be unlocked and made usable in the us,0.0
ORD341811,ID0277368256,2019-07-09,Bakers,"[('Toshika 750', 2), ('Universe Note', 1), ('Candle Inferno', 2)]",12950.0,66.02,-37.8064631,145.0103346,25,9778.52,Winter,False,1.3852,digico - inferno hd8 - 8 - tablet - 16gb - wi-fi - black i purchased this for my sister. i really appreciate the geek squad for setting this product up for her and for teaching me how to use it. now i can pass that i learned onto my sister.,1.0
ORD488614,ID1668523241,2019-03-11,Nickolson,"[('Candle Inferno', 1), ('Olivia x460', 1), ('Toshika 750', 1), ('Thunder line', 2)]",10335.0,63.85,-37.820351,144.9640389,15,8848.6,Autumn,False,0.5226,five stars great,1.0
ORD381691,ID0103121688,2019-10-08,Thompson,"[('Lucent 330S', 1), ('iStream', 2), ('Candle Inferno', 2)]",2390.0,85.64,-37.8132701,144.9549523,0,2475.64,Spring,True,0.6965,didnt like anything sorry not worth a penny that phone. olivia and olivia again. slow bad camera bad video very small,0.0
ORD330607,ID6167489387,2019-01-13,Thompson,"[('iAssist Line', 1), ('Lucent 330S', 1), ('iStream', 1)]",3605.0,,-37.8095602,144.95748759999995,0,3699.83,Summer,True,0.9796,"the best phone ever just as the headline, completely grateful for it, couldn't ask for more.",1.0
ORD209149,ID4330491092,2019-06-02,Thompson,"[('Toshika 750', 2), ('iAssist Line', 1), ('Candle Inferno', 2)]",11725.0,70.91,-37.8205151,144.9272465,15,10037.16,Winter,False,1.9495,great deal! excellent condition. little to no marks. functioning properly.,1.0
ORD373462,ID4419686625,2019-01-16,Thompson,"[('Universe Note', 2), ('Olivia x460', 1), ('Lucent 330S', 2)]",10585.0,83.16,-37.8016526,144.9632253,5,10138.91,Summer,False,1.8773,note 9 review absolutely love this product. no complaints.,1.0
ORD288809,ID0775933327,2019-05-14,,"[('pearTV', 2), ('Olivia x460', 2), ('Toshika 750', 1)]",19390.0,65.98,-37.8061015,144.95851530000004,5,18486.48,Autumn,True,1.2444,bought two in a year since i broke the first ... bought two in a year since i broke the first one and the charger cable is not compatible with each other. contacted them via support. no reply. i would have give it 4* if i get a courtesy reply. i will consider another brand for my next smartphone.,0.0
ORD050398,ID0580161259,2019-08-04,Thompson,"[('pearTV', 1), ('iStream', 1), ('Candle Inferno', 2), ('Alcon 10', 1)]",16270.0,89.47,-37.7891031,144.9380335,15,13918.97,Winter,True,2.7415,i got this candle because i broke my inferno 7'. it took some getting use to since the screen was bigger but overall it was a great purchase.,1.0
ORD029311,ID0844475791,2019-06-03,Thompson,"[('Candle Inferno', 2), ('Olivia x460', 1), ('Alcon 10', 1), ('Lucent 330S', 2)]",13495.0,66.79,-37.8224816,144.9474929,25,10188.04,Winter,False,1.0925,"great buy. i have bought digico refurb products before and have never been disappointed. i have had this phone for several months now and have had ""0"" issues and got it at a great price.",1.0
ORD110454,ID2841675040,2019-05-10,Nickolson,"[('Candle Inferno', 2), ('iAssist Line', 2)]",5310.0,67.06,-37.8080366,144.9689175,25,4049.56,Autumn,False,1.1767,nice phone great smartphone easy to use and great price,1.0
ORD433267,ID4716795375,2019-06-24,Thompson,"[('Candle Inferno', 1), ('pearTV', 1), ('iStream', 2)]",7040.0,62.98,-37.818839,144.95310590000003,15,6046.98,Winter,True,0.8677,"it's obsolete now. as of july 1st, 2018, verizon does not support this phone.",0.0
ORD246623,ID4633770174,2019-10-27,Thompson,"[('iAssist Line', 1), ('iStream', 1), ('pearTV', 1), ('Candle Inferno', 2)]",9545.0,75.99,-37.8070126,144.9457679,25,7234.74,Spring,False,0.6404,five stars good communication device.,1.0
ORD396158,ID0711331333,2019-07-28,Thompson,"[('pearTV', 2), ('iAssist Line', 1), ('Universe Note', 1), ('Toshika 750', 2)]",26935.0,78.4,-37.8066083,144.9571585,25,20279.65,Winter,True,1.115,"its a decent starter phone........ if you want a prepaid phone and you dont wanna be in debt to pear this phone is so great! update: i bought this phone and when i first bought i did love it however i ought-grew this one and ended up getting an pear product for my birthday, its a great budget tho!!",1.0
ORD173356,ID0301542631,2019-04-18,Thompson,"[('Lucent 330S', 1), ('Thunder line', 2)]",5590.0,65.91,-37.8214145,144.9503213,25,4258.41,Autumn,False,1.0142,"great phone i love this phone, don't care that it's a pixel 2, i love this phone, battery life is great!",1.0
ORD149204,ID0767594381,2019-02-03,Nickolson,"[('Alcon 10', 1), ('Lucent 330S', 2), ('iAssist Line', 1)]",13635.0,60.97,-37.8071068,144.9709672,15,11650.72,Summer,False,1.2849,"devolución sin reembolso buenas tardes. el 27 de agosto se aprobó la devolución de este teléfono, sin embargo hasta la presente fecha ( 11 de octubre ) no se ha hthunder el reembolso en mi tarjeta de crédito. por favor su ayuda. saludos",0.0
ORD303182,ID5002594950,2019-10-02,Thompson,"[('iAssist Line', 1), ('Thunder line', 2)]",6585.0,,-37.81224320000001,144.9524053,15,5654.81,Spring,False,0.4717,nunca recibí el celular.. fue sustraído nunca recibí el teléfono celular..,0.0
ORD490183,ID1404219802,2019-04-26,Bakers,"[('pearTV', 1), ('Toshika 750', 2), ('Universe Note', 1), ('Alcon 10', 1)]",27350.0,65.74,-37.80281779999999,144.992404,0,27415.74,Autumn,False,0.8369,five stars great phone. great price,
ORD290586,ID5109337886,2019-11-23,Nickolson,"[('Thunder line', 1), ('Olivia x460', 2)]",4630.0,65.15,-37.8236177,144.982925,15,4000.65,Spring,False,1.3022,one star the home screen button came broken down the middle. very disappointing.,0.0
ORD294736,ID0356215139,2019-05-05,Nickolson,"[('Universe Note', 2), ('iAssist Line', 1), ('Olivia x460', 2), ('Alcon 10', 2)]",29475.0,67.62,-37.8044289,144.9647406,0,29542.62,Autumn,True,1.6327,incomplete order very disappointing with this seller i receipt my phone with scratches in on top of that without charger i strongly not recommended,0.0
ORD329520,ID4698484056,2019-05-23,Bakers,"[('Alcon 10', 2), ('Universe Note', 1)]",21350.0,66.66,-37.8009307,145.005533,15,18214.16,Autumn,False,1.3562,todo perfecto todo perfecto,1.0
ORD023421,ID0581702929,2019-08-01,Thompson,"[('Candle Inferno', 2), ('Lucent 330S', 2)]",3320.0,73.38,-37.815589,144.9219752,25,2563.38,Winter,False,2.2305,nice phone all working battery ok.,1.0
ORD466949,ID4633638468,2019-12-07,Thompson,"[('iStream', 2), ('pearTV', 2), ('Candle Inferno', 1), ('Olivia x460', 1)]",14575.0,71.32,-37.8064602,144.9439695,25,11002.57,Summer,False,0.7434,great phone this is the best phone i have owned by far i like everything if there was a falt everything else is so good that it makes up for it.,1.0
ORD326666,ID0710001172,2019-12-24,Thompson,"[('Toshika 750', 2), ('Candle Inferno', 1), ('iStream', 2)]",9370.0,93.72,-37.8140479,144.93599430000003,15,8058.22,Summer,True,0.9859,"great camera and never crashes. phone works good in general, but after less that 4 or 5 weeks it has a big yellow spot on the screen.",1.0
ORD042987,ID3924911403,2019-07-03,Nickolson,"[('Universe Note', 2), ('Alcon 10', 2)]",24800.0,,-37.81330420000001,144.96560490000005,10,22383.28,Winter,False,0.6836,"great phone !! amazing, my husband will never buy another over priced phone again !",1.0
ORD437304,ID2189398730,2019-03-25,,"[('pearTV', 2), ('Lucent 330S', 2), ('Olivia x460', 2)]",17530.0,80.37,-37.81074260000001,144.97536609999997,10,15857.37,Autumn,True,,i am extremely pleased. fast. efficient. reliable.,1.0
ORD397446,ID0746924710,2019-04-03,Nickolson,"[('Universe Note', 1), ('Alcon 10', 2), ('Candle Inferno', 1), ('pearTV', 1)]",28090.0,80.46,-37.8237043,144.9825536,25,21147.96,Autumn,True,1.277,"i give this an a- i like the phone, just wish there were more options for accessories",
ORD036261,ID0030287528,2019-07-14,Bakers,"[('iStream', 2), ('iAssist Line', 1), ('Alcon 10', 1), ('Toshika 750', 2)]",20115.0,,-37.8095238,144.9904915,5,19182.71,Winter,True,0.4202,great phone for the money so i had the pixel 2 xl before this purchase and was not sure i would be all that impressed with the 3 but hands down this is a better phone. love the wireless charging and the battery lift is much better.,1.0
ORD485381,ID4754200362,2019-03-08,Thompson,"[('iStream', 2), ('Universe Note', 2), ('pearTV', 1), ('Alcon 10', 2)]",31410.0,82.72,-37.8149165,144.9272684,5,29922.22,Autumn,True,1.7591,i love to read! having the candle inferno is like having hundreds of books at my fingertips!,1.0
ORD121071,ID3222703106,2019-07-03,Thompson,"[('Alcon 10', 2), ('Lucent 330S', 2)]",20360.0,,-37.8009234,144.9545386,0,20441.62,Winter,True,1.4637,great product. great product. had no issues with the phone. had a minor issue with activating gsm networks but one call to the seller and i was guided on how to set it up.,1.0
ORD310459,ID4655129058,2019-11-10,Thompson,"[('Thunder line', 2), ('Olivia x460', 2), ('Universe Note', 2)]",13710.0,73.87,-37.809633700000006,144.947356,5,13098.37,Spring,False,0.3393,"great phone at a great price. i'm so glad i bought this phone. it's in excellent condition, works great, and the battery life is better than i thought it'd be. it came with the charger and s pen, all i had to do was put my old sim card in and i was up and running.",1.0
ORD404830,ID3199579115,2019-03-29,Thompson,"[('pearTV', 1), ('Thunder line', 1), ('Olivia x460', 1), ('iAssist Line', 2)]",14165.0,78.26,-37.8152749,144.94467340000003,0,14243.26,Autumn,True,0.3581,good experience good product almost look like new i'm satisfied,
ORD404761,ID5002594982,2019-03-31,Thompson,"[('Alcon 10', 2), ('Thunder line', 1), ('iAssist Line', 2), ('Candle Inferno', 2)]",25390.0,76.82,-37.8120929,144.95131469999995,25,19119.32,Autumn,True,0.3789,five stars great value and price very happy,1.0
ORD348981,ID0589763571,2019-07-11,Thompson,"[('Lucent 330S', 1), ('Universe Note', 2)]",8130.0,79.03,-37.82182589999999,144.9516054,0,8209.03,Winter,True,1.0942,"bought two of these. i was under the impressions ... bought two of these. i was under the impressions that they would both have cortana onboard. however, my husband's phone was the only one that had the app. kind of dissappointed that both weren't equipped with the app.",1.0
ORD445337,ID5448707279,2019-08-07,Thompson,"[('Lucent 330S', 2), ('Universe Note', 1)]",5910.0,79.92,-37.82174970000001,144.9367564,15,5103.42,Winter,True,1.3577,"amazing! so glad the price went down, i love my new phone.",1.0
ORD205379,ID0259132670,2019-06-28,Nickolson,"[('Thunder line', 1), ('Olivia x460', 2), ('Alcon 10', 1), ('Universe Note', 2)]",20480.0,,-37.8256512,144.9600263,15,17487.15,Winter,True,1.1482,the camera works great it takes amazing pics/videos anyone that says it dont ... the phone works great it takes amazing pics/videos anyone that says it dont is just lying thro their teeth js,1.0
ORD404546,ID0303448821,2019-02-14,Bakers,"[('Universe Note', 1), ('Toshika 750', 1)]",7770.0,108.96,-37.824413,145.0154842,15,6713.46,Summer,True,2.3973,five stars nice,1.0
ORD222036,ID4380043479,2019-05-30,,"[('Alcon 10', 1), ('iAssist Line', 2), ('Olivia x460', 1)]",14625.0,83.47,-37.82334760000001,144.9891577,10,13245.97,Autumn,True,1.5793,"universe note 8 note 8 flawless! it looked brand new... no scratches or damage! works like a charm! i will purchase from this seller again as well as recommend their business. also, seller was super nice and professional! thanks!",1.0
ORD280634,ID1985561684,2019-05-25,Nickolson,"[('Alcon 10', 2), ('Universe Note', 2)]",24800.0,62.52,-37.8167146,144.9699771,10,22382.52,Autumn,True,0.2126,"un mal servicio. en goldr lugar, quiero decirles. que sì, yo compré el olivia universe s4 y recivì el olivia universe s3 en sù lugar. además de recivir un artoculo que no era el que estaba supuesto a recivir, el sansung universe s3 que recivì la pantalla giratoria no funciona bien, es decir que el telefono esta averiado.",0.0
ORD030411,ID1492410152,2019-06-01,Thompson,"[('Lucent 330S', 2), ('Olivia x460', 1)]",3685.0,71.81,-37.8019156,144.9635917,15,3204.06,Winter,False,1.883,"five stars amazing phone, design very fancy camera i think one of the best around ! delivery perfect!",1.0
ORD075375,ID1458422319,2019-07-03,Bakers,"[('Olivia x460', 2), ('Lucent 330S', 2), ('Universe Note', 1)]",8360.0,67.97,-37.8178928,145.008265,5,8009.97,Winter,False,1.4444,3d scanning + android o! i was searching for an unlocked phone that had unique feature(s). the 3d scanning sold me on the xz1 + android oreo right out of the gate was an instant winner!,1.0
ORD312509,ID2174950791,2019-12-19,Thompson,"[('iAssist Line', 1), ('Universe Note', 2), ('Olivia x460', 1), ('Alcon 10', 1)]",19300.0,72.14,-37.8161002,144.9528211,15,16477.14,Summer,False,0.6336,five stars love it! takes great pics and hold charge longer! 😍,1.0
ORD205456,ID0871096404,2019-12-16,Thompson,"[('Universe Note', 1), ('Alcon 10', 2), ('iStream', 1)]",21500.0,87.06,-37.7999378,144.960628,10,19437.06,Summer,True,1.8525,beware well in 3 days after the no return window has closed the fast charge is no longer working.,0.0
ORD203715,ID3683319253,2019-02-01,,"[('Candle Inferno', 2), ('Universe Note', 2)]",7760.0,69.25,-37.8129206,144.9913125,5,7441.25,Summer,False,0.4741,"affordable and good vallue i love this little flip! slips conveniently in my back pocket. the new $35 monthly plan is great, too!",1.0
ORD474002,ID0577517162,2019-12-06,Nickolson,"[('iAssist Line', 2), ('iStream', 2)]",4750.0,60.37,-37.827091,144.9749192,5,4572.87,Summer,False,1.057,not soo good it looks and operate very poor,0.0
ORD059130,ID1463620523,2019-03-29,Bakers,"[('Toshika 750', 1), ('Universe Note', 1), ('pearTV', 2), ('Olivia x460', 1)]",21615.0,82.85,-37.8177779,145.00717609999995,15,18455.6,Autumn,True,1.3615,"if you're diehard ms fan nice phone, windows sucks however",
ORD036535,ID5797722980,2019-04-07,Thompson,"[('Thunder line', 2), ('pearTV', 2), ('iAssist Line', 2)]",,50.71,-37.8069943,144.9433669,5,,Autumn,False,0.7111,phone this phone not work on metropcs,0.0
ORD210066,ID6245731037,2019-04-01,Nickolson,"[('Universe Note', 2), ('iAssist Line', 1)]",9125.0,81.16,-37.8107586,144.97710859999995,15,7837.41,Autumn,True,1.0967,five stars works well. as expected.,1.0
ORD401316,ID0588197148,2019-07-06,Nickolson,"[('iAssist Line', 2), ('pearTV', 1)]",10760.0,78.06,-37.8120939,144.9738315,5,10300.06,Winter,True,0.8157,five stars it works great!,1.0
ORD239614,ID3313210943,2019-08-06,Nickolson,"[('Candle Inferno', 2), ('pearTV', 1)]",7170.0,62.2,-37.8185184,144.9670945,25,5439.7,Winter,False,0.2162,"excellent product, mint condition for a refurbished unit - you would never know it's been refurbished!",1.0
ORD406663,ID3109398488,2019-08-07,Nickolson,"[('Thunder line', 1), ('Lucent 330S', 2), ('pearTV', 2), ('Toshika 750', 2)]",25900.0,67.19,-37.8045099,144.97460159999997,10,23377.19,Winter,True,1.6296,won't do that again. i could not use with my carrier. sent it back.,0.0
ORD277066,ID5727168127,2019-12-26,Nickolson,"[('pearTV', 2), ('Candle Inferno', 1)]",13050.0,62.49,-37.8241762,144.98208380000003,5,12459.99,Summer,False,1.2651,"dont buy it add lied and phone doesnt even work, wasted $100+ phone shuts off internet glitches when on wifi and camera shutter sound isn't able to be disabled or even lowered for that matter",
ORD153822,ID5797758279,2019-10-30,Thompson,"[('Candle Inferno', 1), ('Alcon 10', 2)]",18330.0,75.52,-37.8064804,144.9452581,5,17489.02,Spring,False,0.7075,"very happy with the phone very happy with the phone, unfortunately i didn't read the small print and it doesn't have a charger so have to go out and purchase one.",1.0
